{
    "$schema": "../schemas/groups.json",
    "uri": "mastodon.ml/@rf",
    "handle": "@rf@mastodon.ml",
    "title": "R–æ—Å—Å–∏–π—Å–∫–∞—èüêªF–µ–¥–µ—Ä–∞—Ü–∏—è",
    "short_description": "–û–±—ä–µ–¥–∏–Ω–µ–Ω–∏–µ —Ä—É—Å—Å–∫–æ—è–∑—ã—á–Ω—ã—Ö –ø–æ–ª—å–∑–æ–≤–∞—Ç–µ–ª–µ–π –§–µ–¥–∏–≤–µ—Ä—Å–∞, —Å–∞–º–∞—è –ø–æ–ø—É–ª—è—Ä–Ω–∞—è –≥—Ä—É–ø–ø–∞ –æ–±—â–µ–π —Ç–µ–º–∞—Ç–∏–∫–∏",
    "members": 1238,
    "icon": "rf@mastodon.ml.icon.png",
    "thumbnail": "rf@mastodon.ml.banner.png"
}